{
  "$schema": "https://json-schema.org/draft/2020-12/schema",
  "$id": "https://schemas.intelliger.ai/oati/profiles/rwa/v0.1/asset-profile.schema.json",
  "title": "OATI RWA Asset Profile",
  "type": "object",
  "additionalProperties": false,
  "required": ["oati_version", "profile", "id", "issuer_organisation_id", "name", "asset_class", "jurisdiction", "unit", "token", "authorised_roles", "status", "issued_at", "expires_at", "issuer", "proof"],
  "properties": {
    "oati_version": { "const": "1.0" },
    "profile": { "const": "https://specs.intelliger.ai/oati/profiles/rwa/v0.1" },
    "id": { "type": "string", "pattern": "^oati:asset:[A-Za-z0-9._:-]+$" },
    "issuer_organisation_id": { "type": "string", "pattern": "^oati:org:[A-Za-z0-9._:-]+$" },
    "name": { "type": "string", "minLength": 1 },
    "asset_class": { "enum": ["tokenised_fund", "private_credit", "reserve_backed", "commodity_backed", "other"] },
    "jurisdiction": { "type": "string", "minLength": 2 },
    "unit": { "type": "string", "minLength": 1 },
    "token": {
      "type": "object",
      "additionalProperties": false,
      "required": ["network", "contract", "standard"],
      "properties": {
        "network": { "type": "string" },
        "contract": { "type": "string" },
        "standard": { "type": "string" }
      }
    },
    "authorised_roles": { "type": "array", "minItems": 1, "uniqueItems": true, "items": { "enum": ["issuer", "custodian", "administrator", "oracle", "auditor", "operator", "approver"] } },
    "state_policy": {
      "type": "object",
      "additionalProperties": false,
      "properties": {
        "max_claim_age_seconds": { "type": "integer", "minimum": 1 },
        "required_claim_type": { "type": "string" },
        "minimum_approvals": { "type": "integer", "minimum": 1 }
      }
    },
    "status": { "enum": ["active", "suspended", "retired"] },
    "issued_at": { "type": "string", "format": "date-time" },
    "expires_at": { "type": "string", "format": "date-time" },
    "issuer": { "type": "string" },
    "proof": { "$ref": "https://schemas.intelliger.ai/oati/v1/proof.schema.json" }
  }
}
