{
  "oati_version": "1.0",
  "profile": "https://specs.intelliger.ai/oati/profiles/rwa/v0.1",
  "id": "oati:asset:example:eur-reserve-token",
  "issuer_organisation_id": "oati:org:example-issuer",
  "name": "Example EUR Reserve Token",
  "asset_class": "reserve_backed",
  "jurisdiction": "DE",
  "unit": "EUR",
  "token": {
    "network": "eip155:1",
    "contract": "0x1111111111111111111111111111111111111111",
    "standard": "ERC-3643"
  },
  "authorised_roles": ["issuer", "custodian", "oracle", "operator", "approver"],
  "state_policy": {
    "max_claim_age_seconds": 3600,
    "required_claim_type": "reserve_balance",
    "minimum_approvals": 2
  },
  "status": "active",
  "issued_at": "2026-07-27T07:00:00Z",
  "expires_at": "2027-07-27T07:00:00Z",
  "issuer": "oati:org:example-issuer",
  "proof": { "type": "DataIntegrityProof", "signature": "example" }
}
